{
  "$schema": "https://json-schema.org/draft/2020-12/schema",
  "type": "object",
  "additionalProperties": false,
  "required": [
    "schemaVersion",
    "claim",
    "artifact",
    "boundary",
    "journeys",
    "receipts",
    "risks",
    "limitations",
    "nonClaims",
    "rollback"
  ],
  "properties": {
    "$schema": { "type": "string", "minLength": 1 },
    "schemaVersion": { "const": 1 },
    "claim": { "type": "string", "minLength": 1 },
    "artifact": {
      "type": "object",
      "required": ["identity", "sha256"],
      "properties": {
        "identity": { "type": "string", "minLength": 1 },
        "sha256": { "type": "string", "pattern": "^[0-9a-f]{64}$" }
      }
    },
    "boundary": { "type": "string", "minLength": 1 },
    "journeys": { "type": "array", "minItems": 1, "items": { "type": "string", "minLength": 1 } },
    "receipts": {
      "type": "array",
      "minItems": 1,
      "items": {
        "type": "object",
        "required": ["path", "sha256"],
        "properties": {
          "path": { "type": "string", "minLength": 1 },
          "sha256": { "type": "string", "pattern": "^[0-9a-f]{64}$" }
        }
      }
    },
    "risks": { "type": "array", "items": { "type": "string", "minLength": 1 } },
    "limitations": {
      "type": "array",
      "minItems": 1,
      "items": { "type": "string", "minLength": 1 }
    },
    "nonClaims": { "type": "array", "minItems": 1, "items": { "type": "string", "minLength": 1 } },
    "rollback": { "type": "string", "minLength": 1 }
  }
}
